{
  "schema": "ai-sdlc-v2-directional-preflight/v1",
  "manifest_sha256": "ccb82f682de8829e3616d5840447ab67f02e60acbcbe533b532060e1d256c801",
  "execution_order": [
    "session-d8cfaa52df40a0a487110e0f",
    "session-a64ee77580d197d0479606d9",
    "session-b4743fd861d9a05516b8f93e",
    "session-3b1e7061d5dbf5d8c06ed072",
    "session-5fe7920cf3b569fb6deb65f6",
    "session-413c424c9a44a6e533a82eb8",
    "session-2951461e5ccf5915ec6d73a1",
    "session-4cc6188d114a73f3cf530929",
    "session-f320b1b773abf633177921dd",
    "session-ee58873be19b721922150245",
    "session-84230429a8a66ce79136fb47",
    "session-96194b625e89463ca58df9fd",
    "session-c89ccb91ce813b730678320b",
    "session-16ecf6655c6d3fdb838f4a09",
    "session-b458d5943e9f2867d2b89633",
    "session-53d670de4f20bd1eeb2e0ade",
    "session-a594636bb3ea61bb1f12f7f3",
    "session-48908b8bf0904646e654bfe1",
    "session-fff2c7759484820ced0d7494"
  ],
  "output_root": "/private/tmp/ai-sdlc-v2-directional-results/20260820-v1",
  "provider_calls_started": 0,
  "formal_authority_status": "NO-GO",
  "evaluator_classification": "legacy-directional-evaluator",
  "model": "gpt-5.6-sol",
  "reasoning_effort": "high",
  "writer_sessions": 15,
  "expert_sessions": 4,
  "hard_session_cap": 19,
  "technical_retries": 0,
  "input_tokens": null,
  "output_tokens": null,
  "currency_cost": null
}
